my_3_21_yearly_breakdown.csv

Calendar_Year,Total_Spinoffs_Traded,Win_Rate_Pct,Average_Return_Pct
2015,19,78.95,73.56
2016,13,76.92,54.67
2017,20,45.0,-5.32
2018,12,25.0,-15.01
2019,16,68.75,34.35
2020,16,43.75,2.77
2021,16,50.0,-7.86
2022,20,30.0,0.21
2023,30,60.0,49.87
2024,9,88.89,140.91

README.md

# Spinoff-Data-2.0

Annual Performance breakdown
Year: 2015 | Total spinoffs traded: 19 | Win Rate(%): 79.95% | Average Return for Year(%): 73.56%
Year: 2016 | Total spinoffs traded: 13 | Win Rate(%): 76.92% | Average Return for Year(%): 54.67%
Year: 2017 | Total spinoffs traded: 20 | Win Rate(%): 45.00% | Average Return for Year(%): -5.32%
Year: 2018 | Total spinoffs traded: 12 | Win Rate(%): 25.00% | Average Return for Year(%): -15.01%
Year: 2019 | Total spinoffs traded: 16 | Win Rate(%): 68.75% | Average Return for Year(%): 34.35%
Year: 2020 | Total spinoffs traded: 16 | Win Rate(%): 43.75% | Average Return for Year(%): 2.77%
Year: 2021 | Total spinoffs traded: 16 | Win Rate(%): 50.00% | Average Return for Year(%): -7.86%
Year: 2022 | Total spinoffs traded: 20 | Win Rate(%): 30.00% | Average Return for Year(%): 0.21%
Year: 2023 | Total spinoffs traded: 30 | Win Rate(%): 60.00% | Average Return for Year(%): 49.87%
Year: 2024 | Total spinoffs traded: 9 | Win Rate(%): 88.89% | Average Return for Year(%): 140.91%